[
  {
    "source_id": "gu_2022_tsst_salivary_cortisol_meta_analysis",
    "title": "A meta-analysis of salivary cortisol responses in the Trier Social Stress Test to evaluate the effects of speech topics, sex, and sample size",
    "authors": [
      "Haixia Gu",
      "Xue’er Ma",
      "Jingjing Zhao",
      "Chunyu Liu"
    ],
    "year": 2022,
    "journal_or_source": "Comprehensive Psychoneuroendocrinology",
    "doi": "10.1016/j.cpnec.2022.100125",
    "url": "https://pmc.ncbi.nlm.nih.gov/articles/PMC9216334/",
    "pdf_filename": "gu_2022_tsst_salivary_cortisol_meta_analysis.pdf",
    "source_type": "meta_analysis",
    "domain": "HPA_axis_cortisol",
    "access_status": "open_access_full_text",
    "population": "Human TSST participants across included studies",
    "sample_size": "65 articles; 76 sub-studies; 5171 participants",
    "methodology_short": "Meta-analysis of TSST studies that measured salivary cortisol before and after task completion. The authors examined cortisol reactivity and tested moderators including speech topic, sex, sample size, and sex-by-topic interactions.",
    "main_findings_short": [
      "The TSST is a widely used laboratory paradigm for psychosocial stress induction.",
      "Salivary cortisol reactivity is usable as an objective HPA-axis marker in TSST contexts.",
      "Cortisol responses vary by sex and protocol features, so context and sampling design must be represented explicitly.",
      "Baseline and peak salivary cortisol values should be interpreted separately rather than collapsed into a generic stress score."
    ],
    "supported_nodes": [
      "salivary_cortisol_increase",
      "hpa_axis_activation",
      "acute_psychosocial_stress_response",
      "social_evaluative_threat_context"
    ],
    "supported_edges": [
      "salivary_cortisol_increase -> hpa_axis_activation",
      "acute_psychosocial_stress_response -> salivary_cortisol_reactivity",
      "TSST_protocol_features -> cortisol_response_moderation"
    ],
    "limitations": [
      "Specific to TSST and related psychosocial stress protocols.",
      "Cortisol interpretation depends on timing, baseline sampling, sex, sample size, and task details.",
      "Does not support cortisol as a standalone detector of chronic stress or psychological diagnosis."
    ],
    "risk_of_overinterpretation": "medium",
    "evidence_strength_score": 5,
    "use_in_thsi": "Primary quantitative source for HPA-axis/cortisol edges under acute psychosocial stress conditions.",
    "notes_for_thsi": "Use only when stress context and sampling timing are known or explicitly marked as missing."
  },
  {
    "source_id": "mcewen_2000_allostasis_allostatic_load_neuropsychopharmacology",
    "title": "Allostasis and allostatic load: implications for neuropsychopharmacology",
    "authors": [
      "Bruce S. McEwen"
    ],
    "year": 2000,
    "journal_or_source": "Neuropsychopharmacology",
    "doi": "10.1016/S0893-133X(99)00129-3",
    "url": "https://www.nature.com/articles/1395453",
    "pdf_filename": "mcewen_2000_allostasis_allostatic_load_neuropsychopharmacology.pdf",
    "source_type": "theoretical_review",
    "domain": "allostasis",
    "access_status": "full_text_in_library",
    "population": "Conceptual review; human and animal evidence discussed",
    "sample_size": "Not applicable",
    "methodology_short": "Theoretical review synthesizing neuroendocrine, autonomic, behavioral, and brain-based mechanisms of stress adaptation and cumulative physiological burden.",
    "main_findings_short": [
      "Allostasis describes adaptation through physiological change rather than fixed homeostasis.",
      "Stress mediators such as glucocorticoids and catecholamines are protective in the short term but costly when repeatedly or chronically activated.",
      "Allostatic load links stress biology, brain function, systemic disease risk, and psychiatric vulnerability.",
      "The brain is both an interpreter of environmental challenge and a target of stress mediators."
    ],
    "supported_nodes": [
      "allostasis",
      "allostatic_load",
      "stress_adaptation_response",
      "multi_system_dysregulation"
    ],
    "supported_edges": [
      "repeated_stress_responses -> allostatic_load",
      "stress_adaptation_response -> physiological_state_shift",
      "allostatic_load -> health_risk_state"
    ],
    "limitations": [
      "Broad theoretical framework, not a quantitative biomarker validation study.",
      "Does not provide direct individual-level inference rules.",
      "Psychiatric disorder links require clinical evidence and cannot be inferred from biomarkers alone."
    ],
    "risk_of_overinterpretation": "high",
    "evidence_strength_score": 3,
    "use_in_thsi": "Foundational conceptual source for allostasis/allostatic load nodes and multi-system interpretation.",
    "notes_for_thsi": "Use to structure mechanisms, not to assign high-confidence psychological labels."
  },
  {
    "source_id": "shaffer_ginsberg_2017_hrv_metrics_norms",
    "title": "An Overview of Heart Rate Variability Metrics and Norms",
    "authors": [
      "Fred Shaffer",
      "J. P. Ginsberg"
    ],
    "year": 2017,
    "journal_or_source": "Frontiers in Public Health",
    "doi": "10.3389/fpubh.2017.00258",
    "url": "https://pmc.ncbi.nlm.nih.gov/articles/PMC5624990/",
    "pdf_filename": "shaffer_ginsberg_2017_hrv_metrics_norms.pdf",
    "source_type": "methodological_review",
    "domain": "HRV_autonomic_regulation",
    "access_status": "open_access_full_text",
    "population": "Methodological review across HRV measurement contexts",
    "sample_size": "Not applicable",
    "methodology_short": "Review of HRV metrics, recording durations, physiological interpretation, and normative considerations across time-domain, frequency-domain, and nonlinear measures.",
    "main_findings_short": [
      "HRV metrics differ in physiological meaning and should not be treated as interchangeable.",
      "HRV is a non-invasive marker of autonomic regulation, especially when interpreted relative to protocol and baseline.",
      "Recording duration, respiration, age, fitness, health status, medication, and measurement quality affect HRV interpretation.",
      "Ultra-short and short-term HRV measures require caution and are not equivalent to 24-hour recordings."
    ],
    "supported_nodes": [
      "reduced_hrv_relative_to_baseline",
      "low_resting_hrv",
      "autonomic_regulation_shift",
      "parasympathetic_withdrawal"
    ],
    "supported_edges": [
      "reduced_hrv_relative_to_baseline -> autonomic_regulation_shift",
      "hrv_metric_context -> hrv_interpretation_quality",
      "low_resting_hrv -> autonomic_regulation_shift"
    ],
    "limitations": [
      "Methodological review, not a direct stress/emotion validation study.",
      "HRV is not specific to anxiety, depression, fatigue, or stress.",
      "Personal baseline and measurement protocol are mandatory for strong inference."
    ],
    "risk_of_overinterpretation": "high",
    "evidence_strength_score": 4,
    "use_in_thsi": "Primary methodological source for HRV marker nodes and interpretation constraints.",
    "notes_for_thsi": "Forbid direct biomarker-to-diagnosis edges from HRV."
  },
  {
    "source_id": "beese_2022_allostatic_load_measurement_review_of_reviews",
    "title": "Allostatic Load Measurement: A Systematic Review of Reviews, Database Inventory, and Considerations for Neighborhood Research",
    "authors": [
      "Shawna Beese",
      "Julie Postma",
      "Janessa M. Graves"
    ],
    "year": 2022,
    "journal_or_source": "International Journal of Environmental Research and Public Health",
    "doi": "10.3390/ijerph192417006",
    "url": "https://pmc.ncbi.nlm.nih.gov/articles/PMC9779615/",
    "pdf_filename": "beese_2022_allostatic_load_measurement_review_of_reviews.pdf",
    "source_type": "systematic_review_of_reviews",
    "domain": "allostatic_load_measurement",
    "access_status": "open_access_full_text",
    "population": "Allostatic load literature summarized across prior reviews",
    "sample_size": "Review of reviews; includes 18 synthesis reviews according to article abstract/context",
    "methodology_short": "Systematic review of reviews and database inventory focused on how allostatic load is measured and operationalized, with attention to neighborhood and environmental stress research.",
    "main_findings_short": [
      "Allostatic load is commonly operationalized through multi-system biomarker composites rather than a single marker.",
      "Measurement approaches vary substantially across studies and databases.",
      "Environmental and neighborhood stressors are relevant contexts for allostatic load research.",
      "Earlier-life allostatic load can be relevant to later health risk, but operationalization must be explicit."
    ],
    "supported_nodes": [
      "allostatic_load",
      "multi_system_dysregulation",
      "biomarker_composite",
      "environmental_stressor_context"
    ],
    "supported_edges": [
      "multi_system_dysregulation -> allostatic_load",
      "biomarker_composite -> allostatic_load_estimate",
      "measurement_protocol_variability -> allostatic_load_uncertainty"
    ],
    "limitations": [
      "Allostatic load scoring is heterogeneous across studies.",
      "Biomarker availability strongly affects comparability.",
      "Not designed to infer momentary psychological states from wearable data."
    ],
    "risk_of_overinterpretation": "medium",
    "evidence_strength_score": 5,
    "use_in_thsi": "Primary source for operationalizing allostatic load as a multi-system construct.",
    "notes_for_thsi": "Use to define allostatic load measurement metadata and uncertainty fields."
  },
  {
    "source_id": "vandekerckhove_wang_2017_emotion_regulation_sleep",
    "title": "Emotion, emotion regulation and sleep: An intimate relationship",
    "authors": [